### DISCUSSION TITLE
Support for Patroni TLS

### DISCUSSION THREAD

**Discussion by jogalt** [veegres/ivory#631] [General]
Not sure if I'm missing this in the notes somewhere. I'm attempting to setup Ivory to interact with my Patroni cluster to a TLS connection but I don't see an option to enable TLS. The only TLS option is greyed out between SIDECAR and DATABASE

![image](https://github.com/user-attachments/assets/6385c02c-012e-42f2-a1f0-d384831bb839)

**Comment by anselvo** [comment]
Hello, thanks for your question. You need to choose a sidecar option for patroni to work via TLS. Sidecar was chosen as a general name for such tools in case I want to support other tools like patroni.

**Reply by jogalt** [reply]
Can you share how you're making it work? I'm now looking at envoy or stunnel to proxy the connections from my docker host to my cluster subnet.

**Reply by anselvo** [reply]
You need to add proper certs to the Ivory then select them below with the enabled sidecar button. You can add certs to Ivory in the settings there are certs manager. 

I'm not sure what is envoy tbh.

**Reply by jogalt** [reply]
For clarity, this is the response I'm getting with sidecar enabled:

```
Error code: 400 ()
strconv.Atoi: parsing "": invalid syntax.
URL
"/instance/overview"
Request Params
{
    "request": "{\"sidecar\":{\"host\":\"node-01.cluster.local.domain\",\"port\":8008,\"name\":null},\"certs\":{\"clientCAId\":\"bdd430ad-5e71-460d-ab0e-526c27b2260c\",\"clientKeyId\":\"77a4ab2d-1d4b-43c2-b842-0418e230cc43\",\"clientCertId\":\"a952758a-7271-4001-b32f-a3954fd1b0ff\"},\"credentialId\":\"35b97bde-7e2e-4894-a77e-d736ecb9366c\"}"
}
Request Body
-
Stacktrace
"AxiosError: Request failed with status code 400\n    at DB (https://ivory.apps.local.domain:11443/assets/index-BjgFfxlW.js:264:1039)\n    at XMLHttpRequest.T (https://ivory.apps.local.domain:11443/assets/index-BjgFfxlW.js:264:5654)\n    at Uc.request (https://ivory.apps.local.domain:11443/assets/index-BjgFfxlW.js:266:2064)"
```

my client configs
![image](https://github.com/user-attachments/assets/7ca673a4-9142-4547-b8f2-f9d8b021aff9)

Logs from container

```
2025/04/29 17:15:13 [Recovery] 2025/04/29 - 17:15:13 panic recovered:
runtime error: index out of range [2] with length 1
/opt/hostedtoolcache/go/1.23.4/x64/src/runtime/panic.go:115 (0x434413)
/home/runner/work/ivory/ivory/service/src/service/postgres.go:305 (0x9f3957)
/home/runner/work/ivory/ivory/service/src/service/postgres.go:301 (0x9f43d8)
/home/runner/work/ivory/ivory/service/src/service/query.go:67 (0x9f43c2)
/home/runner/work/ivory/ivory/service/src/router/query.go:192 (0xa057ae)
/home/runner/go/pkg/mod/github.com/gin-gonic/gin@v1.10.0/context.go:185 (0x8800ea)
/home/runner/work/ivory/ivory/service/src/router/auth.go:51 (0xa151ae)
/home/runner/go/pkg/mod/github.com/gin-gonic/gin@v1.10.0/context.go:185 (0x8800ea)
[GIN] 2025/04/29 - 17:15:13 | 500 |     900.732µs |        10.1.1.2 | POST     "/api/query/activity"
/home/runner/work/ivory/ivory/service/src/router/secret.go:31 (0xa153a4)
/home/runner/go/pkg/mod/github.com/gin-gonic/gin@v1.10.0/context.go:185 (0x88640e)
/home/runner/go/pkg/mod/github.com/gin-gonic/gin@v1.10.0/recovery.go:102 (0x8863fb)
/home/runner/go/pkg/mod/github.com/gin-gonic/gin@v1.10.0/context.go:185 (0x88640e)
/home/runner/go/pkg/mod/github.com/gin-gonic/gin@v1.10.0/recovery.go:102 (0x8863fb)
/home/runner/go/pkg/mod/github.com/gin-gonic/gin@v1.10.0/context.go:185 (0x885544)
/home/runner/go/pkg/mod/github.com/gin-gonic/gin@v1.10.0/logger.go:249 (0x88552b)
/home/runner/go/pkg/mod/github.com/gin-gonic/gin@v1.10.0/context.go:185 (0x884931)
/home/runner/go/pkg/mod/github.com/gin-gonic/gin@v1.10.0/gin.go:633 (0x8843a0)
/home/runner/go/pkg/mod/github.com/gin-gonic/gin@v1.10.0/gin.go:589 (0x884031)
/home/runner/go/pkg/mod/golang.org/x/net@v0.32.0/http2/h2c/h2c.go:125 (0x87b492)
/opt/hostedtoolcache/go/1.23.4/x64/src/net/http/server.go:3210 (0x752e6d)
/opt/hostedtoolcache/go/1.23.4/x64/src/net/http/server.go:3819 (0x73a5f0)
/opt/hostedtoolcache/go/1.23.4/x64/src/net/http/h2_bundle.go:6249 (0x7110d4)
/opt/hostedtoolcache/go/1.23.4/x64/src/runtime/asm_amd64.s:1700 (0x475980)

[GIN] 2025/04/29 - 17:15:13 | 400 |  129.303791ms |        10.1.1.2 | GET      "/api/instance/overview?request=%7B%22sidecar%22:%7B%22host%22:%22node-01.cluster.local.domain%22,%22port%22:8008,%22name%22:null%7D,%22certs%22:%7B%22clientCAId%22:%22bdd430ad-5e71-460d-ab0e-526c27b2260c%22,%22clientKeyId%22:%2277a4ab2d-1d4b-43c2-b842-0418e230cc43%22,%22clientCertId%22:%22a952758a-7271-4001-b32f-a3954fd1b0ff%22%7D,%22credentialId%22:%2235b97bde-7e2e-4894-a77e-d736ecb9366c%22%7D"


2025/04/29 17:15:18 [Recovery] 2025/04/29 - 17:15:18 panic recovered:
runtime error: index out of range [2] with length 1
/opt/hostedtoolcache/go/1.23.4/x64/src/runtime/panic.go:115 (0x434413)
/home/runner/work/ivory/ivory/service/src/service/postgres.go:305 (0x9f3957)
/home/runner/work/ivory/ivory/service/src/service/postgres.go:301 (0x9f43d8)
/home/runner/work/ivory/ivory/service/src/service/query.go:67 (0x9f43c2)
/home/runner/work/ivory/ivory/service/src/router/query.go:192 (0xa057ae)
/home/runner/go/pkg/mod/github.com/gin-gonic/gin@v1.10.0/context.go:185 (0x8800ea)
/home/runner/work/ivory/ivory/service/src/router/auth.go:51 (0xa151ae)
/home/runner/go/pkg/mod/github.com/gin-gonic/gin@v1.10.0/context.go:185 (0x8800ea)
/home/runner/work/ivory/ivory/service/src/router/secret.go:31 (0xa153a4)
/home/runner/go/pkg/mod/github.com/gin-gonic/gin@v1.10.0/context.go:185 (0x88640e)
/home/runner/go/pkg/mod/github.com/gin-gonic/gin@v1.10.0/recovery.go:102 (0x8863fb)
/home/runner/go/pkg/mod/github.com/gin-gonic/gin@v1.10.0/context.go:185 (0x88640e)
/home/runner/go/pkg/mod/github.com/gin-gonic/gin@v1.10.0/recovery.go:102 (0x8863fb)
/home/runner/go/pkg/mod/github.com/gin-gonic/gin@v1.10.0/context.go:185 (0x885544)
/home/runner/go/pkg/mod/github.com/gin-gonic/gin@v1.10.0/logger.go:249 (0x88552b)
/home/runner/go/pkg/mod/github.com/gin-gonic/gin@v1.10.0/context.go:185 (0x884931)
/home/runner/go/pkg/mod/github.com/gin-gonic/gin@v1.10.0/gin.go:633 (0x8843a0)
/home/runner/go/pkg/mod/github.com/gin-gonic/gin@v1.10.0/gin.go:589 (0x884031)
/home/runner/go/pkg/mod/golang.org/x/net@v0.32.0/http2/h2c/h2c.go:125 (0x87b492)
/opt/hostedtoolcache/go/1.23.4/x64/src/net/http/server.go:3210 (0x752e6d)
/opt/hostedtoolcache/go/1.23.4/x64/src/net/http/server.go:3819 (0x73a5f0)
/opt/hostedtoolcache/go/1.23.4/x64/src/net/http/h2_bundle.go:6249 (0x7110d4)
/opt/hostedtoolcache/go/1.23.4/x64/src/runtime/asm_amd64.s:1700 (0x475980)

[GIN] 2025/04/29 - 17:15:18 | 500 |     928.789µs |        10.1.1.2 | POST     "/api/query/activity"

```

tcpdump from the node-01

```
17:15:13.471785 IP (tos 0x0, ttl 64, id 13372, offset 0, flags [DF], proto TCP (6), length 563)
    node-01.cluster.local.domain.8008 > 10.1.26.1.59566: Flags [P.], cksum 0xd238 (incorrect -> 0x6351), seq 16059:16570, ack 5927, win 481, options [nop,nop,TS val 2878403480 ecr 132682315], length 511
17:15:13.471996 IP (tos 0x0, ttl 62, id 42149, offset 0, flags [DF], proto TCP (6), length 52)
    10.1.26.1.59566 > node-01.cluster.local.domain.8008: Flags [.], cksum 0x3102 (correct), seq 5927, ack 16059, win 685, options [nop,nop,TS val 132682315 ecr 2878403480], length 0
17:15:13.512902 IP (tos 0x0, ttl 62, id 42150, offset 0, flags [DF], proto TCP (6), length 52)
    10.1.26.1.59566 > node-01.cluster.local.domain.8008: Flags [.], cksum 0x2eda (correct), seq 5927, ack 16570, win 685, options [nop,nop,TS val 132682356 ecr 2878403480], length 0
17:15:13.512943 IP (tos 0x0, ttl 64, id 13373, offset 0, flags [DF], proto TCP (6), length 874)
    node-01.cluster.local.domain.8008 > 10.1.26.1.59566: Flags [P.], cksum 0xd36f (incorrect -> 0x8471), seq 16570:17392, ack 5927, win 501, options [nop,nop,TS val 2878403521 ecr 132682356], length 822
17:15:13.513416 IP (tos 0x0, ttl 62, id 42151, offset 0, flags [DF], proto TCP (6), length 52)
    10.1.26.1.59566 > node-01.cluster.local.domain.8008: Flags [.], cksum 0x2b7b (correct), seq 5927, ack 17392, win 685, options [nop,nop,TS val 132682356 ecr 2878403521], length 0
17:15:13.513766 IP (tos 0x0, ttl 62, id 42152, offset 0, flags [DF], proto TCP (6), length 76)
    10.1.26.1.59566 > node-01.cluster.local.domain.8008: Flags [P.], cksum 0x7f6e (correct), seq 5927:5951, ack 17392, win 685, options [nop,nop,TS val 132682357 ecr 2878403521], length 24
17:15:13.513830 IP (tos 0x0, ttl 62, id 42153, offset 0, flags [DF], proto TCP (6), length 52)
    10.1.26.1.59566 > node-01.cluster.local.domain.8008: Flags [F.], cksum 0x2b61 (correct), seq 5951, ack 17392, win 685, options [nop,nop,TS val 132682357 ecr 2878403521], length 0
17:15:13.514121 IP (tos 0x0, ttl 64, id 13374, offset 0, flags [DF], proto TCP (6), length 52)
    node-01.cluster.local.domain.8008 > 10.1.26.1.59566: Flags [F.], cksum 0xd039 (incorrect -> 0x2c17), seq 17392, ack 5952, win 501, options [nop,nop,TS val 2878403522 ecr 132682357], length 0
17:15:13.514474 IP (tos 0x0, ttl 62, id 42154, offset 0, flags [DF], proto TCP (6), length 52)
    10.1.26.1.59566 > node-01.cluster.local.domain.8008: Flags [.], cksum 0x2b5f (correct), seq 5952, ack 17393, win 685, options [nop,nop,TS val 132682357 ecr 2878403522], length 0
```

Results when using normal browser with similar mTLS

```
{"members": [{"name": "node-01.cluster.local.domain", "role": "leader", "state": "running", "api_url": "https://[https://node-01.cluster.local.domain]:8008/patroni", "host": "node-01.cluster.local.domain", "port": 5432, "timeline": 19}, {"name": "node-03.cluster.local.domain", "role": "replica", "state": "streaming", "api_url": "https://[https://node-03.cluster.local.domain]:8008/patroni", "host": "node-03.cluster.local.domain", "port": 5432, "timeline": 19, "lag": 0}], "scope": "cluster_1"}
```

**Reply by jogalt** [reply]
I was messing around with this today and moved the mTLS certs from 

```
/opt/data
```
into 
```
/opt/data/cert
```

After that, the API started correctly polling. What's odd, the ivory TLS certs are in the /opt/data folder and they work fine for the TLS to the ivory host. Here's my mount structure
```
[
  {
    "Type": "bind",
    "Source": "/opt/ivory",
    "Destination": "/opt/data",
    "Mode": "",
    "RW": true,
    "Propagation": "rprivate"
  }
]
```
Here's my directory layout
```
.
├── bolt
│   └── ivory.db
├── cert
│   ├── ca-cert.chain
│   ├── client.crt
│   ├── client.crt.bak
│   ├── client.key
│   └── client.key.bak
├── config
│   └── application.json
├── ivory.crt
├── ivory.key
├── mycsr.csr
├── pgcompacttable
└── query
    ├── 5a464555-29fd-4045-b31b-7bce717c2a53.jsonl
    ├── 9a8d063c-a3bc-4816-a095-d553715a2498.jsonl
    ├── 9c1944c7-289c-4faa-913f-bb8608198559.jsonl
    ├── b11fb5a2-006b-4b12-9c6a-1232afed8fc8.jsonl
    ├── bb88d49a-e317-48b5-a2c9-e7e66c833521.jsonl
    └── e70ec45f-8190-4f16-b57e-fbe13035408b.jsonl

6 directories, 16 files
```

**Reply by anselvo** [reply]
can you show path in Certificate Manager? 

I wonder if you provide full path, because it is require full path. For example I use such path `/opt/vault/server.key` and it works as well.

P.S. I would say that `/data` package use is not a good idea, because app uses it and in the future some folder or file name can be reserved by app and it will break something for you. This package `/opt/data/cert` is used by Ivory to store your uploaded certs

**Reply by jogalt** [reply]
Noted! Overall, this is a great little product and it works as advertised! Thank you for putting your time into making this.

Now just need to make this work with MariaDB/Galera ;)

CA-cert
![image](https://github.com/user-attachments/assets/0655e5a2-4b9c-4a50-90ea-c51058a8216b)

client-cert
![image](https://github.com/user-attachments/assets/821ec4f5-f8de-4d0a-96ca-cc0bd3253f3e)

client-key
![image](https://github.com/user-attachments/assets/57dec32f-a4d6-4a04-8457-bfe064d84c3c)

**Reply by anselvo** [reply]
Looks ok to me, dunno why it didn't work with `/opt/data` path, it should have, I don't remember wether I do some trimming or not, maybe there was some space :shrug: But Ivory should check file for existance and throw error if it doesn't exist in initial save, dunno.

If you can try one more time with `/opt/data` folder and maybe with just something like `/opt/certs` I would really appreciate right the problem is not clear for me :( 

> Overall, this is a great little product and it works as advertised!

Thanks man, I really appriciate it :) 

> Now just need to make this work with MariaDB/Galera ;)

yeah you see I use only these tools and have expirience with them, maybe some day if this project had a lot of stars, I would consider adding more features :)

**Reply by jogalt** [reply]
Did as you asked, looks like there may be something hardcoded to ```/opt/data/cert``` somewhere?

I copied certs into ```/opt/data``` and kept the certs in ```/opt/data/cert``` there was no issue and I was able to select the the certs in ```/opt/data```
```
.
├── bolt
│   └── ivory.db
├── ca-cert.chain
├── cert
│   ├── ca-cert.chain
│   ├── client.crt
│   ├── client.crt.bak
│   ├── client.key
│   └── client.key.bak
├── client.crt
├── client.crt.bak
├── client.key
├── client.key.bak
├── config
│   └── application.json
├── ivory.crt
├── ivory.key
├── mycsr.csr
├── pgcompacttable
└── query
    ├── 02417d37-487f-4aed-840d-1dc4216b5e3c.jsonl
    ├── 5a464555-29fd-4045-b31b-7bce717c2a53.jsonl
    ├── 6f32115f-2481-47ae-a189-765b89dca9ba.jsonl
    ├── 83ac13c0-818f-4013-a482-b32dfa0db010.jsonl
    ├── 9a8d063c-a3bc-4816-a095-d553715a2498.jsonl
    ├── 9c1944c7-289c-4faa-913f-bb8608198559.jsonl
    ├── b11fb5a2-006b-4b12-9c6a-1232afed8fc8.jsonl
    ├── bb88d49a-e317-48b5-a2c9-e7e66c833521.jsonl
    ├── dfb94ad3-82d0-4ba1-b2d8-df132fffd541.jsonl
    └── e70ec45f-8190-4f16-b57e-fbe13035408b.jsonl
```
The second I moved the certs to *.bak in ```/opt/data/cert```, ivory broke
```
.
├── bolt
│   └── ivory.db
├── ca-cert.chain
├── cert
│   ├── ca-cert.chain
│   ├── client.crt.bak
│   └── client.key.bak
├── client.crt
├── client.crt.bak
├── client.key
├── client.key.bak
├── config
│   └── application.json
├── ivory.crt
├── ivory.key
├── mycsr.csr
├── pgcompacttable
└── query
    ├── 02417d37-487f-4aed-840d-1dc4216b5e3c.jsonl
    ├── 5a464555-29fd-4045-b31b-7bce717c2a53.jsonl
    ├── 6f32115f-2481-47ae-a189-765b89dca9ba.jsonl
    ├── 83ac13c0-818f-4013-a482-b32dfa0db010.jsonl
    ├── 9a8d063c-a3bc-4816-a095-d553715a2498.jsonl
    ├── 9c1944c7-289c-4faa-913f-bb8608198559.jsonl
    ├── b11fb5a2-006b-4b12-9c6a-1232afed8fc8.jsonl
    ├── bb88d49a-e317-48b5-a2c9-e7e66c833521.jsonl
    ├── dfb94ad3-82d0-4ba1-b2d8-df132fffd541.jsonl
    └── e70ec45f-8190-4f16-b57e-fbe13035408b.jsonl
```
![image](https://github.com/user-attachments/assets/ef3d29f8-666f-4769-8ddb-356030de9194)

It also looks like on a restart, the certs in ```/opt/data``` were removed from the cert manager

**Reply by jogalt** [reply]
For simplicity and to avoid future errors, I redeployed the container with all certs in the correct location.
```
.
├── bolt
│   └── ivory.db
├── cert
│   ├── ca-cert.chain
│   ├── client.crt
│   ├── client.key
│   ├── ivory.crt
│   └── ivory.key
├── config
│   └── application.json
├── pgcompacttable
└── query
    ├── 02417d37-487f-4aed-840d-1dc4216b5e3c.jsonl
    ├── 5a464555-29fd-4045-b31b-7bce717c2a53.jsonl
    ├── 6f32115f-2481-47ae-a189-765b89dca9ba.jsonl
    ├── 83ac13c0-818f-4013-a482-b32dfa0db010.jsonl
    ├── 9a8d063c-a3bc-4816-a095-d553715a2498.jsonl
    ├── 9c1944c7-289c-4faa-913f-bb8608198559.jsonl
    ├── b11fb5a2-006b-4b12-9c6a-1232afed8fc8.jsonl
    ├── bb88d49a-e317-48b5-a2c9-e7e66c833521.jsonl
    ├── dfb94ad3-82d0-4ba1-b2d8-df132fffd541.jsonl
    └── e70ec45f-8190-4f16-b57e-fbe13035408b.jsonl

6 directories, 17 files
```

**Reply by anselvo** [reply]
Ok, thanks you very much for your help, I will take a look into this someday https://github.com/veegres/ivory/issues/632, there is for sure some improvements can be done, because it is not critical, it won't be soon probably.

**Reply by jogalt** [reply]
No worries, if I start wrapping my head around Golang I'll see if I can help out.
